{
  "schemaVersion": "1.0.0",
  "productId": "mullu-agents",
  "proofState": "AwaitingEvidence",
  "claimsAllowed": [],
  "claimsBlockedUntilVerified": [
    "production tool execution",
    "rollback-safe agent runs",
    "operator policy witness"
  ],
  "witnesses": [
    {
      "name": "runtime",
      "state": "AwaitingEvidence",
      "evidence": "agent-runner-service runtime witness is not published."
    },
    {
      "name": "contract",
      "state": "AwaitingEvidence",
      "evidence": "POST /v1/agents/run is declared but not deployed."
    },
    {
      "name": "rollback",
      "state": "AwaitingEvidence",
      "evidence": "Mullu Agents rollback path is not yet witnessed."
    },
    {
      "name": "privacy",
      "state": "AwaitingEvidence",
      "evidence": "Mullu Agents privacy and retention policies are declared in not-active state."
    }
  ]
}
