{
  "schemaVersion": "1.0.0",
  "productId": "virecai-video",
  "proofState": "AwaitingEvidence",
  "claimsAllowed": [],
  "claimsBlockedUntilVerified": [
    "media rights boundary",
    "artifact storage witness",
    "signed processing witness"
  ],
  "witnesses": [
    {
      "name": "runtime",
      "state": "AwaitingEvidence",
      "evidence": "video-processing-service runtime witness is not published."
    },
    {
      "name": "contract",
      "state": "AwaitingEvidence",
      "evidence": "POST /v1/video/process is declared but not deployed."
    },
    {
      "name": "rollback",
      "state": "AwaitingEvidence",
      "evidence": "VIRECAI Video rollback path is not yet witnessed."
    },
    {
      "name": "privacy",
      "state": "AwaitingEvidence",
      "evidence": "VIRECAI Video privacy and retention policies are declared in not-active state."
    }
  ]
}
