{
  "schemaVersion": "1.0.0",
  "productId": "mullu-studio-music",
  "proofState": "AwaitingEvidence",
  "claimsAllowed": [],
  "claimsBlockedUntilVerified": [
    "rights boundary",
    "export policy closure",
    "reproducible audio witness"
  ],
  "witnesses": [
    {
      "name": "runtime",
      "state": "AwaitingEvidence",
      "evidence": "music-service runtime witness is not published."
    },
    {
      "name": "contract",
      "state": "AwaitingEvidence",
      "evidence": "POST /v1/music/generate is declared but not deployed."
    },
    {
      "name": "rollback",
      "state": "AwaitingEvidence",
      "evidence": "Mullu Studio Music rollback path is not yet witnessed."
    },
    {
      "name": "privacy",
      "state": "AwaitingEvidence",
      "evidence": "Mullu Studio Music privacy and retention policies are declared in not-active state."
    }
  ]
}
