{
  "schemaVersion": "1.0.0",
  "productId": "robotics-tools",
  "proofState": "AwaitingEvidence",
  "claimsAllowed": [],
  "claimsBlockedUntilVerified": [
    "physical safety floor",
    "simulator witness",
    "operator approval path"
  ],
  "witnesses": [
    {
      "name": "runtime",
      "state": "AwaitingEvidence",
      "evidence": "robotics-service runtime witness is not published."
    },
    {
      "name": "contract",
      "state": "AwaitingEvidence",
      "evidence": "POST /v1/robotics/simulate is declared but not deployed."
    },
    {
      "name": "rollback",
      "state": "AwaitingEvidence",
      "evidence": "Robotics Tools rollback path is not yet witnessed."
    },
    {
      "name": "privacy",
      "state": "AwaitingEvidence",
      "evidence": "Robotics Tools privacy and retention policies are declared in not-active state."
    }
  ]
}
